Sheet: ArrayXML
A1: 天赋库 | B1: 天赋id | C1: 抽取概率 | D1: 抽取概率
A2: group | B2: talent_id | C2: chance | D2: www | E2: ttt | F2: rate | G2: embed
A3: group | B3: talent_id | C3: chance | D3: www | E3: ttt | F3: rate | G3: embed
A4: int | B4: int | C4: int | D4: vector | E4: vector | F4: int | G4: embed
A5: 1001 | B5: 101 | C5: 100 | D5: age=18 | E5: age=18,point=60|age=19,point=59 | F5: =IF(RC[-5]<>R[-1]C[-5],RC[6],RC[6]+R[-1]C) -> 10 | G5: 1 | L5: 10
A6: 1001 | B6: 102 | C6: 100 | D6: age=19 | E6: age=18,point=60|age=19,point=60 | F6: =IF(RC[-5]<>R[-1]C[-5],RC[6],RC[6]+R[-1]C) -> 30 | G6: 2 | L6: 20
A7: 1001 | B7: 103 | C7: 100 | D7: age=20 | E7: age=18,point=60|age=19,point=61 | F7: =IF(RC[-5]<>R[-1]C[-5],RC[6],RC[6]+R[-1]C) -> 51 | G7: 3 | L7: 21
A8: 1001 | B8: 201 | C8: 100 | D8: age=21 | E8: age=18,point=60|age=19,point=62 | F8: =IF(RC[-5]<>R[-1]C[-5],RC[6],RC[6]+R[-1]C) -> 73 | G8: 4 | L8: 22
A9: 1001 | B9: 202 | C9: 100 | D9: age=22 | E9: age=18,point=60|age=19,point=63 | F9: =IF(RC[-5]<>R[-1]C[-5],RC[6],RC[6]+R[-1]C) -> 108 | G9: 5 | L9: 35
A10: 1001 | B10: 203 | C10: 100 | D10: age=23 | E10: age=18,point=60|age=19,point=64 | F10: =IF(RC[-5]<>R[-1]C[-5],RC[6],RC[6]+R[-1]C) -> 132 | G10: 6 | L10: 24
A11: 1001 | B11: 301 | C11: 100 | D11: age=24 | E11: age=18,point=60|age=19,point=65 | F11: =IF(RC[-5]<>R[-1]C[-5],RC[6],RC[6]+R[-1]C) -> 157 | G11: 7 | L11: 25
A12: 1001 | B12: 302 | C12: 100 | D12: age=25 | E12: age=18,point=60|age=19,point=66 | F12: =IF(RC[-5]<>R[-1]C[-5],RC[6],RC[6]+R[-1]C) -> 183 | G12: 8 | L12: 26
A13: 1001 | B13: 303 | C13: 100 | D13: age=26 | E13: age=18,point=60|age=19,point=67 | F13: =IF(RC[-5]<>R[-1]C[-5],RC[6],RC[6]+R[-1]C) -> 224 | G13: 9 | L13: 41
A14: 1002 | B14: 101 | C14: 100 | D14: age=27 | E14: age=18,point=60|age=19,point=68 | F14: =IF(RC[-5]<>R[-1]C[-5],RC[6],RC[6]+R[-1]C) -> 28 | G14: 10 | L14: 28
A15: 1002 | B15: 102 | C15: 100 | D15: age=28 | E15: age=18,point=60|age=19,point=69 | F15: =IF(RC[-5]<>R[-1]C[-5],RC[6],RC[6]+R[-1]C) -> 57 | G15: 11 | L15: 29
A16: 1002 | B16: 103 | C16: 100 | D16: age=29 | E16: age=18,point=60|age=19,point=70 | F16: =IF(RC[-5]<>R[-1]C[-5],RC[6],RC[6]+R[-1]C) -> 87 | G16: 12 | L16: 30
A17: 1002 | B17: 104 | C17: 100 | D17: age=30 | E17: age=18,point=60|age=19,point=71 | F17: =IF(RC[-5]<>R[-1]C[-5],RC[6],RC[6]+R[-1]C) -> 97 | G17: 13 | L17: 10
A18: 1002 | B18: 201 | C18: 100 | D18: age=31 | E18: age=18,point=60|age=19,point=72 | F18: =IF(RC[-5]<>R[-1]C[-5],RC[6],RC[6]+R[-1]C) -> 129 | G18: 14 | L18: 32
A19: 1002 | B19: 202 | C19: 100 | D19: age=32 | E19: age=18,point=60|age=19,point=73 | F19: =IF(RC[-5]<>R[-1]C[-5],RC[6],RC[6]+R[-1]C) -> 192 | G19: 15 | L19: 63
A20: 1002 | B20: 203 | C20: 100 | D20: age=33 | E20: age=18,point=60|age=19,point=74 | F20: =IF(RC[-5]<>R[-1]C[-5],RC[6],RC[6]+R[-1]C) -> 236 | G20: 16 | L20: 44
A21: 1002 | B21: 204 | C21: 100 | D21: age=34 | E21: age=18,point=60|age=19,point=75 | F21: =IF(RC[-5]<>R[-1]C[-5],RC[6],RC[6]+R[-1]C) -> 271 | G21: 17 | L21: 35
A22: 1002 | B22: 301 | C22: 100 | D22: age=35 | E22: age=18,point=60|age=19,point=76 | F22: =IF(RC[-5]<>R[-1]C[-5],RC[6],RC[6]+R[-1]C) -> 341 | G22: 18 | L22: 70

Sheet: @embed
A1: 时装id | B1: 强化等级 | C1: 成功率
A2: bid | B2: level | C2: rate
A3: bid | B3: level | C3: rate
A4: int | B4: int | C4: int
A5: 1 | B5: 0 | C5: 23
A6: 2 | B6: 3 | C6: 2
A7: 2 | B7: 4 | C7: 14
A8: 2 | B8: 5 | C8: 26
A9: 3 | B9: 6 | C9: 38
A10: 3 | B10: 7 | C10: 50
A11: 3 | B11: 8 | C11: 62
A12: 4 | B12: 9 | C12: 74
A13: 4 | B13: 10 | C13: 86
A14: 4 | B14: 11 | C14: 98
A15: 5 | B15: 12 | C15: 110
A16: 5 | B16: 13 | C16: 122
A17: 5 | B17: 14 | C17: 119
A18: 6 | B18: 15 | C18: 116
A19: 6 | B19: 16 | C19: 113
A20: 6 | B20: 17 | C20: 110
A21: 7 | B21: 18 | C21: 107
A22: 7 | B22: 19 | C22: 104
A23: 7 | B23: 20 | C23: 101
A24: 8 | B24: 0 | C24: 23
A25: 8 | B25: 1 | C25: 3
A26: 8 | B26: 2 | C26: 33
A27: 9 | B27: 3 | C27: 2
A28: 9 | B28: 4 | C28: 14
A29: 9 | B29: 5 | C29: 26
A30: 10 | B30: 6 | C30: 38
A31: 10 | B31: 7 | C31: 50
A32: 10 | B32: 8 | C32: 62
A33: 11 | B33: 9 | C33: 74
A34: 11 | B34: 10 | C34: 86
A35: 11 | B35: 11 | C35: 98
A36: 12 | B36: 12 | C36: 110
A37: 12 | B37: 13 | C37: 122
A38: 12 | B38: 14 | C38: 119
A39: 13 | B39: 15 | C39: 116
A40: 13 | B40: 16 | C40: 113
A41: 13 | B41: 17 | C41: 110
A42: 14 | B42: 18 | C42: 107
A43: 14 | B43: 19 | C43: 104
A44: 14 | B44: 20 | C44: 101
A45: 15 | B45: 0 | C45: 23
A46: 15 | B46: 1 | C46: 3
A47: 15 | B47: 2 | C47: 33
A48: 16 | B48: 3 | C48: 2
A49: 16 | B49: 4 | C49: 14
A50: 16 | B50: 5 | C50: 26
A51: 17 | B51: 6 | C51: 38
A52: 17 | B52: 7 | C52: 50
A53: 17 | B53: 8 | C53: 62
A54: 18 | B54: 9 | C54: 74
A55: 18 | B55: 10 | C55: 86
A56: 18 | B56: 11 | C56: 98